Item,Stem,Answer,A,B,C,D,E,F
1,"You have a certain amount of math intelligence, and you can't really do much to change it.",A,Disagree A Lot,Disagree,Disagree A Little,Agree A Little,Agree,Agree A Lot
2,"You can learn new math skills, but you can't really change your basic math intelligence.",A,Disagree A Lot,Disagree,Disagree A Little,Agree A Little,Agree,Agree A Lot
3,Your math intelligence is something about you that you can't change very much.,A,Disagree A Lot,Disagree,Disagree A Little,Agree A Little,Agree,Agree A Lot
4,"No matter who you are, you can significantly change your math intelligence level.",A,Disagree A Lot,Disagree,Disagree A Little,Agree A Little,Agree,Agree A Lot
5,"When I work hard, it makes me feel as though I am not very smart.",A,Disagree A Lot,Disagree,Disagree A Little,Agree A Little,Agree,Agree A Lot
6,"When I work hard, it makes me feel as though I am not very smart.",A,Disagree A Lot,Disagree,Disagree A Little,Agree A Little,Agree,Agree A Lot
7,"When I work hard, it makes me feel as though I am not very smart.",A,Disagree A Lot,Disagree,Disagree A Little,Agree A Little,Agree,Agree A Lot
8,"When I work hard, it makes me feel as though I am not very smart.",A,Disagree A Lot,Disagree,Disagree A Little,Agree A Little,Agree,Agree A Lot